id,name,firstAppearance,role,summary,description,workIds,published
emiya-shirou,衛宮士郎,2004-01-30,主人公,『Fate/stay night』の主人公。正義の味方を目指し、聖杯戦争に参加する。,幼い頃の大火災をきっかけに、誰かを救う生き方を選んだ少年。複数ルートで異なる成長を見せる。,fate-stay-night;fgo,TRUE
saber,セイバー,2004-01-30,サーヴァント,士郎と契約する剣士のサーヴァント。高い戦闘能力と誇り高い精神を持つ。,騎士王としての責務と個人の願いの間で葛藤する。Fateシリーズを象徴する人気キャラクター。,fate-stay-night;fate-zero;fgo,TRUE
tohsaka-rin,遠坂凛,2004-01-30,魔術師,遠坂家の後継者として聖杯戦争に挑む優秀な魔術師。,冷静な判断力と行動力を持ち、時に厳しく時に面倒見のよい性格で物語を引っ張る。,fate-stay-night;fgo,TRUE
ryougi-shiki,両儀式,2004-06-01,主人公,『空の境界』の主人公。直死の魔眼を持ち、怪異事件に立ち向かう。,静かな佇まいの中に強い意志を持つ人物。死の概念を視る力で常識外れの戦いを可能にする。,kara-no-kyoukai;fgo,TRUE
archetype-earth,アルクェイド・ブリュンスタッド,2000-12-29,吸血鬼,『月姫』のメインヒロイン。真祖として圧倒的な力を持つ吸血鬼。,無邪気さと強大な存在感を併せ持ち、主人公・遠野志貴の運命を大きく変える存在。,tsukihime-remake;fgo,TRUE
